institution_id,institution_name,country_name,latitude,longitude,research_level
151328261,Hampton University (US),United States,37.02987,-76.34522,R2
151808059,Colorado School of Public Health (US),United States,39.72943,-104.83192,
153297377,Medical University of South Carolina (US),United States,32.77657,-79.93092,R1
153901656,University of North Carolina Wilmington (US),United States,34.23556,-77.94604,R2
154057602,Henry Ford Health System (US),United States,42.33143,-83.04575,
154570441,"University of California, Santa Barbara (US)",United States,34.42083,-119.69819,R1
155093810,University of Idaho (US),United States,46.73239,-117.00017,R1
155173764,Rochester Institute of Technology (US),United States,43.15478,-77.61556,R2
155781252,University of South Carolina (US),United States,34.00071,-81.03481,R1
156087764,"University of California, Merced (US)",United States,37.30216,-120.48297,R1
156802259,Eastern Virginia Medical School (US),United States,36.84681,-76.28522,R2
157394403,Baylor University (US),United States,31.54933,-97.14667,R1
157417397,Bowling Green State University (US),United States,41.37477,-83.65132,R2
157638225,"California State University, Northridge (US)",United States,34.22834,-118.53675,D/PU
157725225,University of Illinois Urbana-Champaign (US),United States,40.11059,-88.20727,R1
158012942,University of Richmond (US),United States,37.55376,-77.46026,D/PU
159548981,State Street (United States) (US),United States,42.35843,-71.05977,
160606119,University of Tennessee Health Science Center (US),United States,35.14953,-90.04898,R1
160856358,University of San Diego (US),United States,32.71571,-117.16472,R2
161057412,University of New Hampshire (US),United States,43.13397,-70.92645,R1
161318765,"University of California, Los Angeles (US)",United States,34.05223,-118.24368,R1
161675122,Cooperative Institute for Research in Environmental Sciences (US),United States,40.01499,-105.27055,
162577319,The University of Texas at Dallas (US),United States,32.94818,-96.72972,R1
162714631,George Mason University (US),United States,38.84622,-77.30637,R1
164389053,Fordham University (US),United States,40.71427,-74.00597,R2
164936912,The University of Texas at El Paso (US),United States,31.75872,-106.48693,R1
165102784,Duquesne University (US),United States,40.44062,-79.99589,R2
165139151,University of North Texas Health Science Center (US),United States,32.72541,-97.32085,D/PU
165690674,Oregon Health & Science University (US),United States,45.52345,-122.67621,R2
165733156,University of Georgia (US),United States,33.96095,-83.37794,R1
165799507,Rensselaer Polytechnic Institute (US),United States,42.72841,-73.69179,R1
165951966,The University of Texas Health Science Center at San Antonio (US),United States,29.42412,-98.49363,R1
166088655,Montclair State University (US),United States,40.82593,-74.20903,R2
166416128,DEVCOM Army Research Laboratory (US),United States,39.00317,-76.97192,
166722992,University of Massachusetts Chan Medical School (US),United States,42.26259,-71.80229,R2
167576493,Colorado School of Mines (US),United States,39.75554,-105.2211,R1
168537998,Eli Lilly (United States) (US),United States,39.76838,-86.15804,
168959743,University of America (US),United States,33.55391,-117.21392,
169071179,Cancer Research Institute (US),United States,40.71427,-74.00597,
169335092,University of North Carolina at Greensboro (US),United States,36.07264,-79.79198,R2
169521973,University of New Mexico (US),United States,35.08449,-106.65114,R1
169615421,Middle Tennessee State University (US),United States,35.84562,-86.39027,R2
170201317,University of Pittsburgh (US),United States,40.44062,-79.99589,R1
170632171,Washington State University Spokane (US),United States,47.65966,-117.42908,
170897317,Duke University (US),United States,35.99403,-78.89862,R1
172980758,Kennesaw State University (US),United States,34.02343,-84.61549,
173268674,Texas A&M University System (US),United States,30.62798,-96.33441,
173911158,Iowa State University (US),United States,42.03471,-93.61994,R1
174216632,City University of New York (US),United States,40.71427,-74.00597,
175003984,Office of Naval Research (US),United States,38.88101,-77.10428,
175594653,John Brown University (US),United States,36.18814,-94.5405,
177097968,University of Tennessee at Chattanooga (US),United States,35.04563,-85.30968,D/PU
177156846,South Dakota State University (US),United States,44.31136,-96.79839,R2
177605424,Amherst College (US),United States,42.37537,-72.51925,D/PU
177607063,The Lundquist Institute (US),United States,33.83585,-118.34063,
177721651,Oakland University (US),United States,42.68059,-83.13382,R2
178169726,Southern Methodist University (US),United States,32.78306,-96.80667,R1
180297670,RTI International (US),United States,35.99403,-78.89862,
180670191,"University of California, San Francisco (US)",United States,37.77493,-122.41942,R1
180857899,Pfizer (United States) (US),United States,40.71427,-74.00597,
180949307,Illinois Institute of Technology (US),United States,41.85003,-87.65005,R2
181190671,New York Medical College (US),United States,41.07482,-73.77513,D/PU
181233156,University of Oregon (US),United States,44.05207,-123.08675,R1
181401687,American University (US),United States,38.89511,-77.03637,R1
181547552,Baylor College of Medicine (US),United States,29.76328,-95.36327,R1
181565077,Georgia State University (US),United States,33.749,-84.38798,R1
181697535,SUNY Downstate Health Sciences University (US),United States,40.6501,-73.94958,
183874917,Urbana University (US),United States,40.10839,-83.75243,
184565670,Georgetown University (US),United States,38.89511,-77.03637,R1
184840846,Virginia Commonwealth University (US),United States,37.55376,-77.46026,R1
185071736,Chapman University (US),United States,33.78779,-117.85311,R2
185103710,"University of California, Santa Cruz (US)",United States,36.97412,-122.0308,R1
185443292,Wayne State University (US),United States,42.33143,-83.04575,R1
186143895,Lehigh University (US),United States,40.62593,-75.37046,R1
186335123,East Carolina University (US),United States,35.61266,-77.36635,R1
186523950,Regeneron (United States) (US),United States,41.07621,-73.85875,
188497080,Carleton College (US),United States,44.4583,-93.1616,D/PU
188538660,University of Colorado Boulder (US),United States,40.01499,-105.27055,R1
188703185,GTx (United States) (US),United States,35.14953,-90.04898,
188891513,Sanford Burnham Prebys Medical Discovery Institute (US),United States,32.84727,-117.2742,
189158971,United States Naval Academy (US),United States,38.97859,-76.49184,D/PU
189196454,The University of Texas at Arlington (US),United States,32.73569,-97.10807,R1
189273616,Rosalind Franklin University of Medicine and Science (US),United States,42.32558,-87.84118,D/PU
189590672,Kansas State University (US),United States,39.18361,-96.57167,R1
189957204,University of South Dakota (US),United States,42.77944,-96.92921,R2
191429286,Sam Houston State University (US),United States,30.72353,-95.55078,R2
192389796,Humboldt State University (US),United States,40.86652,-124.08284,D/PU
192396691,University of New Orleans (US),United States,29.95465,-90.07507,R2
192454743,Sandia National Laboratories California (US),United States,37.68187,-121.76801,
192545095,United States Military Academy (US),United States,41.39148,-73.95597,D/PU
193531525,George Washington University (US),United States,38.89511,-77.03637,R1
196272386,Providence College (US),United States,41.82399,-71.41283,D/PU
196729704,Southern Illinois University School of Medicine (US),United States,39.80172,-89.64371,
196817621,Carnegie Institution for Science (US),United States,38.89511,-77.03637,
197604219,"National Academies of Sciences, Engineering, and Medicine (US)",United States,38.89511,-77.03637,
198089087,Ball State University (US),United States,40.19338,-85.38636,R2
198423848,National Institute for Occupational Safety and Health (US),United States,38.89511,-77.03637,
198811213,National Nuclear Security Administration (US),United States,38.89511,-77.03637,
200719446,Vanderbilt University (US),United States,36.16589,-86.78444,R1
200870766,Brookhaven National Laboratory (US),United States,40.86954,-72.88677,
201448701,University of Washington (US),United States,47.60621,-122.33207,R1
203088144,Nova Southeastern University (US),United States,26.12231,-80.14338,R1
203172682,Northern Arizona University (US),United States,35.19807,-111.65127,R1
204250578,"University of California, Irvine (US)",United States,33.66946,-117.82311,R1
204308271,Medical College of Wisconsin (US),United States,43.0389,-87.90647,R2
204465549,Washington University in St. Louis (US),United States,38.62727,-90.19789,R1
204866599,VA Palo Alto Health Care System (US),United States,37.44188,-122.14302,
205783295,Cornell University (US),United States,42.44063,-76.49661,R1
208333798,University of Missouri–St. Louis (US),United States,38.62727,-90.19789,R2
210824098,Wilmington University (US),United States,39.65948,-75.56359,
219193219,Purdue University West Lafayette (US),United States,40.42587,-86.90807,R1
223532165,University of Utah (US),United States,40.76078,-111.89105,R1
227586296,American Physical Therapy Association (US),United States,38.80484,-77.04692,
257179599,Baker Hughes (United States) (US),United States,29.76328,-95.36327,
267592682,Williams (United States) (US),United States,36.15398,-95.99277,
285663978,Weatherford College (US),United States,32.7593,-97.79725,
368840534,University of Mississippi (US),United States,34.3665,-89.51925,R1
859038795,Virginia Tech (US),United States,37.22957,-80.41394,R1
867280407,The University of Texas Southwestern Medical Center (US),United States,32.78306,-96.80667,
870398029,Center for Excellence in Education (US),United States,38.93428,-77.17748,
872248612,Claremont Colleges (US),United States,34.09668,-117.71978,
880747138,Science Applications International Corporation (United States) (US),United States,38.93428,-77.17748,
880766802,Graduate School USA (US),United States,38.89511,-77.03637,
888729015,University of Colorado Colorado Springs (US),United States,38.83388,-104.82136,R2
889937125,National Patient Safety Foundation (US),United States,42.35843,-71.05977,
893718555,Joint Base San Antonio (US),United States,29.42412,-98.49363,
896114043,Edward Via College of Osteopathic Medicine (US),United States,37.22957,-80.41394,D/PU
901861585,Vanderbilt University Medical Center (US),United States,36.16589,-86.78444,
919571938,The University of Texas Health Science Center at Houston (US),United States,29.76328,-95.36327,
921990950,University of Colorado Denver (US),United States,39.73915,-104.9847,R1
922845939,Philadelphia University (US),United States,39.95238,-75.16362,
923382979,ExxonMobil (United States) (US),United States,32.81402,-96.94889,
926076166,Texas Tech University Health Sciences Center (US),United States,33.57786,-101.85517,R2
1280259254,Henry M. Jackson Foundation (US),United States,38.98067,-77.10026,
1280414376,United States Air Force Research Laboratory (US),United States,39.81113,-84.05731,
1280536761,Ames Research Center (US),United States,37.38605,-122.08385,
1280640908,The Nature Conservancy (US),United States,38.88101,-77.10428,
1281378812,Oak Ridge Associated Universities (US),United States,36.01036,-84.26964,
1281539108,Hospital for Special Surgery (US),United States,40.71427,-74.00597,
1281704429,Christiana Care Health System (US),United States,39.74595,-75.54659,
1282105669,Argonne National Laboratory (US),United States,41.67364,-88.00173,
1282311441,Lawrence Livermore National Laboratory (US),United States,37.68187,-121.76801,
1282516798,Atrium Health Wake Forest Baptist (US),United States,36.09986,-80.24422,
1282927834,Cedars-Sinai Medical Center (US),United States,34.05223,-118.24368,
1283055418,Indiana University Health (US),United States,39.76838,-86.15804,
1283103587,AT&T (United States) (US),United States,40.68066,-74.64544,
1283280774,Brigham and Women's Hospital (US),United States,42.35843,-71.05977,
1283621791,New York City Health and Hospitals Corporation (US),United States,40.71427,-74.00597,
1283654650,Prisma Health (US),United States,34.85262,-82.39401,
1285204247,Cincinnati Children's Hospital Medical Center (US),United States,39.12711,-84.51439,
1285210727,University of Kentucky HealthCare (US),United States,37.98869,-84.47772,
1285301757,Rush University Medical Center (US),United States,41.85003,-87.65005,
1285739803,MedStar Washington Hospital Center (US),United States,38.89511,-77.03637,
1285764155,"Merck & Co., Inc., Rahway, NJ, USA (United States) (US)",United States,40.60816,-74.27765,
1286329397,United States Geological Survey (US),United States,38.96872,-77.3411,
1286490081,Boston Medical Center (US),United States,42.35843,-71.05977,
1286959531,United Nations (US),United States,40.71427,-74.00597,
1287163989,Massachusetts Eye and Ear Infirmary (US),United States,42.35843,-71.05977,
1287521167,Lockheed Martin (United States) (US),United States,38.98067,-77.10026,
1287643137,Mount Sinai Beth Israel (US),United States,40.71427,-74.00597,
1288162130,University of Colorado Hospital (US),United States,39.72943,-104.83192,
1288198617,American Cancer Society (US),United States,33.749,-84.38798,
1288214837,United States Naval Research Laboratory (US),United States,38.89511,-77.03637,
1288882113,Boston Children's Hospital (US),United States,42.35843,-71.05977,
1289243028,Oak Ridge National Laboratory (US),United States,36.01036,-84.26964,
1289422878,Dartmouth–Hitchcock Medical Center (US),United States,43.64229,-72.25176,
1289437631,Fox Chase Cancer Center (US),United States,39.95238,-75.16362,
1289490764,Centers for Disease Control and Prevention (US),United States,33.749,-84.38798,
1289568071,San Antonio Military Medical Center (US),United States,29.42412,-98.49363,
1289702989,University System of Georgia (US),United States,33.749,-84.38798,
1289739345,Winthrop-University Hospital (US),United States,40.74927,-73.64068,
1290055561,St. Luke's University Health Network (US),United States,40.62593,-75.37046,
1290206253,Microsoft (United States) (US),United States,47.67399,-122.12151,
1290463931,Southwest Research Institute (US),United States,29.42412,-98.49363,
1290900354,Tufts Medical Center (US),United States,42.35843,-71.05977,
1291425158,Google (United States) (US),United States,37.38605,-122.08385,
1292894508,Roswell Park Comprehensive Cancer Center (US),United States,42.88645,-78.87837,
1292974536,Ford Motor Company (United States) (US),United States,42.32226,-83.17631,
1293487830,Geisinger Medical Center (US),United States,40.96342,-76.61273,
1293502524,Loma Linda University Medical Center (US),United States,34.04835,-117.26115,
1294278766,Lurie Children's Hospital (US),United States,41.85003,-87.65005,
1294504835,Marshall Space Flight Center (US),United States,34.68387,-86.64764,
1295339012,Boeing (United States) (US),United States,41.85003,-87.65005,
1295346377,Monsanto (United States) (US),United States,38.66089,-90.42262,
1295499534,Seattle Children's Hospital (US),United States,47.60621,-122.33207,
1295876152,Houston Methodist (US),United States,29.76328,-95.36327,
1295908608,San Francisco General Hospital (US),United States,37.77493,-122.41942,
1296604144,Memorial Hospital of South Bend (US),United States,41.68338,-86.25001,
1297127228,Space Telescope Science Institute (US),United States,39.29038,-76.61219,
1297288678,National Renewable Energy Laboratory (US),United States,39.75554,-105.2211,
1297463080,Children's Medical Center (US),United States,32.78306,-96.80667,
1297540436,Biogen (United States) (US),United States,42.3751,-71.10561,
1298060332,New York State Department of Health (US),United States,42.65258,-73.75623,
1298154867,Kennedy Krieger Institute (US),United States,39.29038,-76.61219,
1298353152,SRI International (US),United States,37.45383,-122.18219,
1299022934,United States Department of Health and Human Services (US),United States,38.89511,-77.03637,
1299218025,MetroHealth (US),United States,41.4995,-81.69541,
1299303238,National Institutes of Health (US),United States,38.98067,-77.10026,
1299501804,Michael E. DeBakey VA Medical Center (US),United States,29.76328,-95.36327,
1299725459,Barnes-Jewish Hospital (US),United States,38.62727,-90.19789,
1299907687,Bloomberg (United States) (US),United States,40.71427,-74.00597,
1301076528,City Of Hope National Medical Center (US),United States,34.13945,-117.97729,
1302163369,Hartford Hospital (US),United States,41.76371,-72.68509,
1302368450,Environmental Protection Agency (US),United States,38.89511,-77.03637,
1302444339,Northwell Health (US),United States,40.7351,-73.68791,
1302918504,Planetary Science Institute (US),United States,32.22174,-110.92648,
1302991022,Milken Institute (US),United States,34.01949,-118.49138,
1303243448,UMass Memorial Health Care (US),United States,42.26259,-71.80229,
1304082316,United States Department of the Army (US),United States,38.88101,-77.10428,
1304196042,Loyola University Medical Center (US),United States,41.8792,-87.84312,
1304256225,University of Wisconsin System (US),United States,43.07305,-89.40123,
1304269903,Trinity Health (US),United States,42.36837,-83.35271,
1304808963,National Park Service (US),United States,38.89511,-77.03637,
1305001552,Grady Memorial Hospital (US),United States,33.749,-84.38798,
1306266525,Goddard Space Flight Center (US),United States,39.00455,-76.87553,
1306490931,United States Army Corps of Engineers (US),United States,38.89511,-77.03637,
1306686416,RTX (United States) (US),United States,38.88101,-77.10428,
1306862143,Memorial Hermann (US),United States,29.76328,-95.36327,
1307098950,Salk Institute for Biological Studies (US),United States,32.84727,-117.2742,
1307117695,Nebraska Medical Center (US),United States,41.25626,-95.94043,
1308126019,National Oceanic and Atmospheric Administration (US),United States,38.89511,-77.03637,
1309104334,Fairview Health Services (US),United States,44.97997,-93.26384,
1309191912,Research Triangle Park Foundation (US),United States,35.99403,-78.89862,
1309849503,RAND Corporation (US),United States,34.01949,-118.49138,
1310145890,International Monetary Fund (US),United States,38.89511,-77.03637,
1310421338,Allegheny Health Network (US),United States,40.44062,-79.99589,
1311060795,U.S. National Science Foundation (US),United States,38.80484,-77.04692,
1311688040,Amazon (United States) (US),United States,47.60621,-122.33207,
1311914864,Scripps Health (US),United States,32.71571,-117.16472,
1312106833,Biotechnology Institute (US),United States,38.89511,-77.03637,
1312222531,Agricultural Research Service (US),United States,38.89511,-77.03637,
1312537475,Naval Medical Research Command (US),United States,38.99067,-77.02609,
1313298211,St. Jude Children's Research Hospital (US),United States,35.14953,-90.04898,
1313416372,US Forest Service (US),United States,38.89511,-77.03637,
1313867356,Association of Universities For Research In Astronomy (US),United States,38.89511,-77.03637,
1314135232,Nationwide Children's Hospital (US),United States,39.96118,-82.99879,
1314596251,Allen Institute for Brain Science (US),United States,47.60621,-122.33207,
1314696892,Fermi National Accelerator Laboratory (US),United States,41.85003,-88.31257,
1315496137,University of Maryland Medical Center (US),United States,39.29038,-76.61219,
1315708478,San Francisco VA Medical Center (US),United States,37.77493,-122.41942,
1315792047,"American Society of Composers, Authors and Publishers (US)",United States,40.71427,-74.00597,
1316535847,Beth Israel Deaconess Medical Center (US),United States,42.35843,-71.05977,
1316902750,Cleveland Clinic (US),United States,41.4995,-81.69541,
1316910977,DuPont (United States) (US),United States,39.74595,-75.54659,
1317227900,University System of Maryland (US),United States,39.00317,-76.97192,
1317239608,Federal Reserve (US),United States,38.89511,-77.03637,
1318687432,National Academy of Sciences (US),United States,38.89511,-77.03637,
1319063186,Langley Research Center (US),United States,37.02987,-76.34522,
1320320070,United States Food and Drug Administration (US),United States,38.99067,-77.02609,
1320343167,Ascension (US),United States,38.62727,-90.19789,
1320354487,Target (United States) (US),United States,44.97997,-93.26384,
1320553840,Amgen (United States) (US),United States,34.17056,-118.83759,
1320796813,Mount Sinai Health System (US),United States,40.71427,-74.00597,
1321296531,National Institute of Standards and Technology (US),United States,39.14344,-77.20137,
1321305853,National Bureau of Economic Research (US),United States,42.3751,-71.10561,
1321404777,Presbyterian Healthcare Services (US),United States,35.08449,-106.65114,
1321572752,St. Luke's-Roosevelt Hospital Center (US),United States,40.71427,-74.00597,
1321686444,Westchester Medical Center (US),United States,41.07482,-73.77513,
1322918889,United States Department of Veterans Affairs (US),United States,38.89511,-77.03637,
1323778983,Yale New Haven Hospital (US),United States,41.30815,-72.92816,
1324220072,Mount Sinai Hospital (US),United States,40.71427,-74.00597,
1324520350,Hackensack University Medical Center (US),United States,40.88593,-74.04347,
1324766304,Barrow Neurological Institute (US),United States,33.44838,-112.07404,
1324840837,Hewlett-Packard (United States) (US),United States,37.44188,-122.14302,
1325481341,St. Joseph's Hospital and Medical Center (US),United States,33.44838,-112.07404,
1325736334,Battelle (US),United States,39.96118,-82.99879,
1326872476,Maimonides Medical Center (US),United States,40.71427,-74.00597,
1326929380,Allina Health (US),United States,44.97997,-93.26384,
1327069482,National Institute on Drug Abuse (US),United States,38.98067,-77.10026,
1327163397,State University of New York (US),United States,42.65258,-73.75623,
1327576362,Feinstein Institute for Medical Research (US),United States,40.79788,-73.69957,
1328359107,Los Angeles County Department of Health Services (US),United States,34.05223,-118.24368,
1328499231,BJC HealthCare (US),United States,38.62727,-90.19789,
1328594524,Children's Mercy Hospital (US),United States,39.09973,-94.57857,
1328969757,Naval Sea Systems Command (US),United States,38.89511,-77.03637,
1329528197,Minneapolis Institute of Arts (US),United States,44.97997,-93.26384,
1330063522,Johnson & Johnson (United States) (US),United States,40.48622,-74.45182,
1330342723,Mayo Clinic (US),United States,44.02163,-92.4699,
1330347796,United States Department of Defense (US),United States,38.89511,-77.03637,
1330989302,United States Department of Energy (US),United States,38.89511,-77.03637,
1331384533,University of Hawaii System (US),United States,21.30694,-157.85834,
1332460256,Wildlife Conservation Society (US),United States,40.71427,-74.00597,
1332737386,General Electric (United States) (US),United States,42.35843,-71.05977,
1333370159,Motorola (United States) (US),United States,42.03336,-88.08341,
1333535994,University of North Carolina Health Care (US),United States,35.9132,-79.05584,
1333606569,Center for Drug Evaluation and Research (US),United States,38.99067,-77.02609,
1334016132,Lucile Packard Children's Hospital (US),United States,37.44188,-122.14302,
1334069289,Carolinas Healthcare System (US),United States,35.22709,-80.84313,
1334095494,New York City Department of Health and Mental Hygiene (US),United States,40.71427,-74.00597,
1334329717,World Bank (US),United States,38.89511,-77.03637,
1334627681,Jet Propulsion Laboratory (US),United States,34.19917,-118.18785,
1334819555,Memorial Sloan Kettering Cancer Center (US),United States,40.71427,-74.00597,
1335289525,Montefiore Medical Center (US),United States,40.84985,-73.86641,
1335321130,Children's Hospital of Philadelphia (US),United States,39.95238,-75.16362,
1335486098,Electric Power Research Institute (US),United States,37.44188,-122.14302,
1335927249,United States Department of the Interior (US),United States,38.89511,-77.03637,
1336053918,Ochsner Health System (US),United States,29.95465,-90.07507,
1336096307,United States Department of Agriculture (US),United States,38.89511,-77.03637,
1336742384,Children's National (US),United States,38.89511,-77.03637,
1336910626,Children's Hospital of Los Angeles (US),United States,34.05223,-118.24368,
1338124936,American Museum of Natural History (US),United States,40.71427,-74.00597,
1338449461,Baystate Medical Center (US),United States,42.10148,-72.58981,
1338503839,Corning (United States) (US),United States,42.14285,-77.05469,
1339417872,Wadsworth Center (US),United States,42.65258,-73.75623,
1339509835,NorthShore University HealthSystem (US),United States,42.04114,-87.69006,
1340179700,NewYork–Presbyterian Hospital (US),United States,40.71427,-74.00597,
1341412227,IBM (United States) (US),United States,41.12648,-73.71402,
1341618623,National Museum of Natural History (US),United States,38.89511,-77.03637,
1342924430,LAC+USC Medical Center (US),United States,34.05223,-118.24368,
1343028186,United States Fish and Wildlife Service (US),United States,38.88233,-77.17109,
1343035065,United States Department of Commerce (US),United States,38.89511,-77.03637,
1343052199,Kaiser Permanente (US),United States,37.80437,-122.2708,
1343180700,Intel (United States) (US),United States,37.35411,-121.95524,
1343551460,The University of Texas MD Anderson Cancer Center (US),United States,29.76328,-95.36327,
1343871089,Los Alamos National Laboratory (US),United States,35.88808,-106.30697,
1344073410,Howard Hughes Medical Institute (US),United States,39.00287,-77.07115,
2750212522,Cold Spring Harbor Laboratory (US),United States,40.87149,-73.45679,
2799343972,University Hospitals of Cleveland (US),United States,41.4995,-81.69541,
2799356940,University Corporation for Atmospheric Research (US),United States,40.01499,-105.27055,
2799359367,Clinical Orthopaedics and Related Research (US),United States,39.95238,-75.16362,
2799360765,Thomas Jefferson University Hospital (US),United States,39.95238,-75.16362,
