institution_id,institution_name,country_name,latitude,longitude,research_level
4210137549,Halliburton (United States) (US),United States,29.76328,-95.36327,
4210137555,Regional Medical Center (US),United States,33.49182,-80.85565,
4210137750,UC Irvine Health (US),United States,33.78779,-117.85311,
4210137803,Biomedical Research Institute (US),United States,39.084,-77.15276,
4210138024,VA Northwest Network (US),United States,45.63873,-122.66149,
4210138094,Agricultural Research Service - Northeast Area (US),United States,39.03483,-76.90747,
4210138309,Center for Innovation (US),United States,38.89511,-77.03637,
4210138311,Lawrence Livermore National Security (US),United States,37.68187,-121.76801,
4210138500,Massachusetts Eye Research and Surgery Institute (US),United States,42.3751,-71.10561,
4210138636,South Central VA Health Care Network (US),United States,32.42848,-90.13231,
4210138663,VA Desert Pacific Healthcare Network (US),United States,33.76696,-118.18923,
4210140114,Scripps (United States) (US),United States,39.12711,-84.51439,
4210140176,Takeda (United States) (US),United States,42.17114,-87.84451,
4210140341,Allen Institute (US),United States,47.60621,-122.33207,
4210140405,Society of Surgical Oncology (US),United States,41.99531,-87.88451,
4210140816,Gilead Sciences (United States) (US),United States,37.55855,-122.27108,
4210140884,National Cancer Institute (US),United States,38.98067,-77.10026,
4210140958,Ann Arbor Center for Independent Living (US),United States,42.27756,-83.74088,
4210141039,Mississippi Institutions of Higher Learning (US),United States,32.29876,-90.18481,
4210141337,Division of Atmospheric and Geospace Sciences (US),United States,38.88101,-77.10428,
4210141674,Cedars-Sinai Smidt Heart Institute (US),United States,34.05223,-118.24368,
4210142152,ORCID (US),United States,38.98067,-77.10026,
4210142217,Washington Center (US),United States,38.89511,-77.03637,
4210142393,Abbott Fund (US),United States,41.85003,-87.65005,
4210142480,Thermo Fisher Scientific (United States) (US),United States,42.37649,-71.23561,
4210142672,Brookhaven Science Associates (US),United States,40.92565,-73.14094,
4210143137,University of Louisville Hospital (US),United States,38.25424,-85.75941,
4210143381,San Francisco VA Health Care System (US),United States,37.77493,-122.41942,
4210143392,University of Pennsylvania Health System (US),United States,39.95238,-75.16362,
4210144023,VA Heart of Texas Health Care Network (US),United States,32.73569,-97.10807,
4210144228,Eunice Kennedy Shriver National Institute of Child Health and Human Development (US),United States,38.98067,-77.10026,
4210144267,Shriners Hospitals for Children (US),United States,27.94752,-82.45843,
4210144560,Candid (US),United States,40.71427,-74.00597,
4210144876,Duke University Health System (US),United States,35.99403,-78.89862,
4210145274,Agricultural Research Service - Plains Area (US),United States,40.58526,-105.08442,
4210145812,Cancer Genetics (United States) (US),United States,40.82649,-74.10681,
4210146328,Scripps Clinic (US),United States,32.84727,-117.2742,
4210146389,Presbyterian St. Luke's Medical Center (US),United States,39.73915,-104.9847,
4210146710,Mayo Clinic in Florida (US),United States,30.33218,-81.65565,
4210146983,Children's Healthcare of Atlanta (US),United States,33.749,-84.38798,
4210147155,Pediatrics and Genetics (US),United States,34.07538,-84.29409,
4210147340,VA Healthcare-VISN 4 (US),United States,40.44062,-79.99589,
4210147348,Northwestern Medicine (US),United States,41.85003,-87.65005,
4210147586,Texas Children's Hospital (US),United States,29.76328,-95.36327,
4210147799,Millennium Engineering and Integration (United States) (US),United States,38.88101,-77.10428,
4210148048,Rothman Institute (US),United States,39.95238,-75.16362,
4210148268,University of Utah Health Care (US),United States,40.76078,-111.89105,
4210148589,Hackensack Meridian Health (US),United States,40.51872,-74.4121,
4210148682,National Center for Advancing Translational Sciences (US),United States,39.084,-77.15276,
4210149382,Johnson Space Center (US),United States,29.76328,-95.36327,
4210149717,Center for Cancer Research (US),United States,38.98067,-77.10026,
4210149743,Sinai Health System (US),United States,41.85003,-87.65005,
4210150094,Ludwig Cancer Research (US),United States,40.71427,-74.00597,
4210150208,Molecular Oncology (United States) (US),United States,39.14344,-77.20137,
4210150362,Children's Cancer Center (US),United States,27.94752,-82.45843,
4210150714,Johns Hopkins Hospital (US),United States,39.29038,-76.61219,
4210150756,AstraZeneca (United States) (US),United States,39.74595,-75.54659,
4210150878,Radiance Technologies (United States) (US),United States,34.7304,-86.58594,
4210150894,Jacobs (United States) (US),United States,32.78306,-96.80667,
4210150980,Boston Children's Museum (US),United States,42.35843,-71.05977,
4210151215,Auburn University System (US),United States,32.60986,-85.48078,
4210151386,Janssen (United States) (US),United States,40.38927,-74.76183,
4210151747,Lifespan (US),United States,41.82399,-71.41283,
4210152133,Florida Certification Board (US),United States,30.43826,-84.28073,
4210153043,Duke University Hospital (US),United States,35.99403,-78.89862,
4210153153,Creative Research Enterprises (United States) (US),United States,37.66243,-121.87468,
4210153546,Flatiron Health (United States) (US),United States,40.71427,-74.00597,
4210153792,University School (US),United States,41.4995,-81.69541,
4210154437,United States Army Futures Command (US),United States,30.26715,-97.74306,
4210154632,Agricultural Research Service - Midwest Area (US),United States,40.69365,-89.58899,
4210155419,Center for Systems Biology (US),United States,42.35843,-71.05977,
4210155647,National Institutes of Health Clinical Center (US),United States,38.98067,-77.10026,
4210156829,Research Network (United States) (US),United States,34.02343,-84.61549,
4210156876,VA Greater Los Angeles Healthcare System (US),United States,34.05223,-118.24368,
4210157065,Sylvester Comprehensive Cancer Center (US),United States,25.77427,-80.19366,
4210157085,Cooper University Health Care (US),United States,39.92595,-75.11962,
4210157264,MetroHealth Medical Center (US),United States,41.4995,-81.69541,
4210157321,Center for Discovery (US),United States,33.80307,-118.07256,
4210157557,Iowa City Public Library (US),United States,41.66113,-91.53017,
4210157861,Harvard Stem Cell Institute (US),United States,42.3751,-71.10561,
4210157890,Neurological Surgery (US),United States,40.65871,-73.64124,
4210158053,University of North Carolina System (US),United States,35.7721,-78.63861,
4210158188,Japan Society (US),United States,40.71427,-74.00597,
4210158500,National Institute of Mental Health (US),United States,38.98067,-77.10026,
4210159288,Mylan (United States) (US),United States,40.26257,-80.18728,
4210159294,UT-Battelle (US),United States,36.01036,-84.26964,
4210159453,Center for Rheumatology (US),United States,42.65258,-73.75623,
4210159720,VA Mid-Atlantic Health Care Network (US),United States,35.99403,-78.89862,
4210160255,Boehringer Ingelheim (United States) (US),United States,41.28148,-73.49818,
4210160401,National Center for Infectious Diseases (US),United States,33.749,-84.38798,
4210160418,Baylor Scott & White Health (US),United States,32.78306,-96.80667,
4210160527,University of California Davis Medical Center (US),United States,38.58157,-121.4944,
4210160641,Alamo Colleges (US),United States,29.42412,-98.49363,
4210160694,Memorial Hospital (US),United States,39.9626,-76.72774,
4210160856,UC Davis Health System (US),United States,38.58157,-121.4944,
4210160970,Access to Wholistic and Productive Living Institute (US),United States,38.93317,-76.94581,
4210161994,Dana-Farber Brigham Cancer Center (US),United States,42.35843,-71.05977,
4210162197,Vanderbilt Health (US),United States,36.16589,-86.78444,
4210162359,International Neuromodulation Society (US),United States,37.77493,-122.41942,
4210163017,Texas Health Resources Foundation (US),United States,32.73569,-97.10807,
4210163141,Yes Technologies (United States) (US),United States,20.02323,-155.67288,
4210164053,LifeBridge Health (US),United States,39.29038,-76.61219,
4210164117,Walker (United States) (US),United States,45.29984,-122.77371,
4210164401,Sidney Kimmel Comprehensive Cancer Center (US),United States,39.29038,-76.61219,
4210164563,"Neurology, Inc (US)",United States,38.95171,-92.33407,
4210165183,Pulmonary and Critical Care Associates (US),United States,30.33218,-81.65565,
4210165192,Smilow Cancer Hospital (US),United States,41.30815,-72.92816,
4210165260,Mercy Health (US),United States,39.12711,-84.51439,
4210165985,Harbor–UCLA Medical Center (US),United States,33.83585,-118.34063,
4210166271,"Center for Surveillance, Epidemiology, and Laboratory Services (US)",United States,33.749,-84.38798,
4210166946,Imaging Center (US),United States,41.1306,-85.12886,
4210167126,UCSF Helen Diller Family Comprehensive Cancer Center (US),United States,37.77493,-122.41942,
4210167218,Georgia Regents Medical Center (US),United States,33.47097,-81.97484,
4387153466,Weill Cornell Medicine (US),United States,40.71427,-74.00597,R1
