topic_id,topic_name,field_name,field_id_scaled,domain_id,domain_name,domain_id_scaled
14465,"Leadership, Behavior, and Decision-Making Studies",Decision Sciences,7,2,Social Sciences,1
14509,demographic modeling and climate adaptation,Decision Sciences,7,2,Social Sciences,1
10102,scientometrics and bibliometrics research,Decision Sciences,7,2,Social Sciences,1
10206,Meta-analysis and systematic reviews,Decision Sciences,7,2,Social Sciences,1
10928,Probabilistic and Robust Engineering Design,Decision Sciences,7,2,Social Sciences,1
11357,Risk and Safety Analysis,Decision Sciences,7,2,Social Sciences,1
11443,Advanced Statistical Process Monitoring,Decision Sciences,7,2,Social Sciences,1
11890,Scientific Measurement and Uncertainty Evaluation,Decision Sciences,7,2,Social Sciences,1
13309,Reliability and Agreement in Measurement,Decision Sciences,7,2,Social Sciences,1
13880,Innovative Education Methods and Tools,Decision Sciences,7,2,Social Sciences,1
14406,Multidisciplinary Science and Engineering Research,Decision Sciences,7,2,Social Sciences,1
10007,Monetary Policy and Economic Impact,"Economics, Econometrics and Finance",8,2,Social Sciences,1
10128,Global trade and economics,"Economics, Econometrics and Finance",8,2,Social Sciences,1
11599,Aviation Industry Analysis and Trends,"Economics, Econometrics and Finance",8,2,Social Sciences,1
11742,Economic Theory and Policy,"Economics, Econometrics and Finance",8,2,Social Sciences,1
11823,Natural Resources and Economic Development,"Economics, Econometrics and Finance",8,2,Social Sciences,1
13172,Economic Issues in Ukraine,"Economics, Econometrics and Finance",8,2,Social Sciences,1
13346,Digital Transformation in Financial Services,"Economics, Econometrics and Finance",8,2,Social Sciences,1
13473,Economic Zones and Regional Development,"Economics, Econometrics and Finance",8,2,Social Sciences,1
13475,Digital Transformation in Law,"Economics, Econometrics and Finance",8,2,Social Sciences,1
13498,Economic Development and Digital Transformation,"Economics, Econometrics and Finance",8,2,Social Sciences,1
13499,Economic Systems and Logistics Management,"Economics, Econometrics and Finance",8,2,Social Sciences,1
14112,"Economic, financial, and policy analysis","Economics, Econometrics and Finance",8,2,Social Sciences,1
10208,Labor market dynamics and wage inequality,"Economics, Econometrics and Finance",8,2,Social Sciences,1
10391,Healthcare Policy and Management,"Economics, Econometrics and Finance",8,2,Social Sciences,1
10393,Economic Growth and Productivity,"Economics, Econometrics and Finance",8,2,Social Sciences,1
10438,"Energy, Environment, Economic Growth","Economics, Econometrics and Finance",8,2,Social Sciences,1
10471,Climate Change Policy and Economics,"Economics, Econometrics and Finance",8,2,Social Sciences,1
10605,Historical Economic and Social Studies,"Economics, Econometrics and Finance",8,2,Social Sciences,1
10632,Housing Market and Economics,"Economics, Econometrics and Finance",8,2,Social Sciences,1
10758,Cinema and Media Studies,"Economics, Econometrics and Finance",8,2,Social Sciences,1
10785,Economic Theory and Institutions,"Economics, Econometrics and Finance",8,2,Social Sciences,1
10804,"Health Systems, Economic Evaluations, Quality of Life","Economics, Econometrics and Finance",8,2,Social Sciences,1
10841,Economic and Environmental Valuation,"Economics, Econometrics and Finance",8,2,Social Sciences,1
10987,Microfinance and Financial Inclusion,"Economics, Econometrics and Finance",8,2,Social Sciences,1
10991,Game Theory and Voting Systems,"Economics, Econometrics and Finance",8,2,Social Sciences,1
11014,Regional Economics and Spatial Analysis,"Economics, Econometrics and Finance",8,2,Social Sciences,1
11043,Merger and Competition Analysis,"Economics, Econometrics and Finance",8,2,Social Sciences,1
11059,Market Dynamics and Volatility,"Economics, Econometrics and Finance",8,2,Social Sciences,1
11257,Taxation and Compliance Studies,"Economics, Econometrics and Finance",8,2,Social Sciences,1
11270,Complex Systems and Time Series Analysis,"Economics, Econometrics and Finance",8,2,Social Sciences,1
11621,Fiscal Policies and Political Economy,"Economics, Econometrics and Finance",8,2,Social Sciences,1
11674,Sports Analytics and Performance,"Economics, Econometrics and Finance",8,2,Social Sciences,1
11711,COVID-19 Pandemic Impacts,"Economics, Econometrics and Finance",8,2,Social Sciences,1
11762,"Law, Economics, and Judicial Systems","Economics, Econometrics and Finance",8,2,Social Sciences,1
11770,Fiscal Policy and Economic Growth,"Economics, Econometrics and Finance",8,2,Social Sciences,1
11792,Pharmaceutical Economics and Policy,"Economics, Econometrics and Finance",8,2,Social Sciences,1
11898,Economics of Agriculture and Food Markets,"Economics, Econometrics and Finance",8,2,Social Sciences,1
11911,Spatial and Panel Data Analysis,"Economics, Econometrics and Finance",8,2,Social Sciences,1
12052,Polish socio-economic development,"Economics, Econometrics and Finance",8,2,Social Sciences,1
12137,Economic theories and models,"Economics, Econometrics and Finance",8,2,Social Sciences,1
12394,Insurance and Financial Risk Management,"Economics, Econometrics and Finance",8,2,Social Sciences,1
12446,Economic Growth and Fiscal Policies,"Economics, Econometrics and Finance",8,2,Social Sciences,1
12641,Historical and socio-economic studies of Spain and related regions,"Economics, Econometrics and Finance",8,2,Social Sciences,1
12708,Economic and Financial Impacts of Cancer,"Economics, Econometrics and Finance",8,2,Social Sciences,1
12722,Innovation Policy and R&D,"Economics, Econometrics and Finance",8,2,Social Sciences,1
12825,"Defense, Military, and Policy Studies","Economics, Econometrics and Finance",8,2,Social Sciences,1
12851,Firm Innovation and Growth,"Economics, Econometrics and Finance",8,2,Social Sciences,1
13007,Economic Sanctions and International Relations,"Economics, Econometrics and Finance",8,2,Social Sciences,1
13042,Economic and Fiscal Studies,"Economics, Econometrics and Finance",8,2,Social Sciences,1
13138,Legal and Constitutional Studies,"Economics, Econometrics and Finance",8,2,Social Sciences,1
13227,Diverse Global Economic and Educational Challenges,"Economics, Econometrics and Finance",8,2,Social Sciences,1
13237,Socio-economic Development and Sustainability,"Economics, Econometrics and Finance",8,2,Social Sciences,1
13255,"Business, Innovation, and Economy","Economics, Econometrics and Finance",8,2,Social Sciences,1
13278,Economic and Business Development Strategies,"Economics, Econometrics and Finance",8,2,Social Sciences,1
13370,Diverse Scientific and Economic Studies,"Economics, Econometrics and Finance",8,2,Social Sciences,1
13387,"Politics, Economics, and Education Policy","Economics, Econometrics and Finance",8,2,Social Sciences,1
13389,German Economic Analysis & Policies,"Economics, Econometrics and Finance",8,2,Social Sciences,1
13399,Unemployment and Economic Growth,"Economics, Econometrics and Finance",8,2,Social Sciences,1
13407,Regional Development and Management Studies,"Economics, Econometrics and Finance",8,2,Social Sciences,1
13411,Labor Market and Education,"Economics, Econometrics and Finance",8,2,Social Sciences,1
13442,Geochemistry and Geochronology of Asian Mineral Deposits,"Economics, Econometrics and Finance",8,2,Social Sciences,1
13472,Brazilian History and Foreign Policy,"Economics, Econometrics and Finance",8,2,Social Sciences,1
13547,Economic and Industrial Development,"Economics, Econometrics and Finance",8,2,Social Sciences,1
13588,Regional resilience and development,"Economics, Econometrics and Finance",8,2,Social Sciences,1
13713,Diverse Perspectives in Modern Studies,"Economics, Econometrics and Finance",8,2,Social Sciences,1
13825,Economic Policies and Impacts,"Economics, Econometrics and Finance",8,2,Social Sciences,1
13894,Indian Economic and Social Development,"Economics, Econometrics and Finance",8,2,Social Sciences,1
13949,Belt and Road Initiative,"Economics, Econometrics and Finance",8,2,Social Sciences,1
13961,Socioeconomics of Resources and Conservation,"Economics, Econometrics and Finance",8,2,Social Sciences,1
14008,Balkan and Eastern European Studies,"Economics, Econometrics and Finance",8,2,Social Sciences,1
14051,Regional Economic and Spatial Analysis,"Economics, Econometrics and Finance",8,2,Social Sciences,1
14066,Economic Development and Regional Competitiveness,"Economics, Econometrics and Finance",8,2,Social Sciences,1
14094,Italy: Economic History and Contemporary Issues,"Economics, Econometrics and Finance",8,2,Social Sciences,1
14113,Global Socioeconomic and Political Dynamics,"Economics, Econometrics and Finance",8,2,Social Sciences,1
14129,Economic and Business Studies,"Economics, Econometrics and Finance",8,2,Social Sciences,1
14143,Economic and Technological Innovation,"Economics, Econometrics and Finance",8,2,Social Sciences,1
14213,Global Politics and Economy,"Economics, Econometrics and Finance",8,2,Social Sciences,1
14223,Ayn Rand and Brontë studies,"Economics, Econometrics and Finance",8,2,Social Sciences,1
14230,Occupational and Professional Licensing Regulation,"Economics, Econometrics and Finance",8,2,Social Sciences,1
14231,New Zealand Economic and Social Studies,"Economics, Econometrics and Finance",8,2,Social Sciences,1
14261,Herbal Medicine and Trade Cooperation,"Economics, Econometrics and Finance",8,2,Social Sciences,1
14294,Impulse Buying and Technology Impacts,"Economics, Econometrics and Finance",8,2,Social Sciences,1
14325,Diverse Specialized Academic Research,"Economics, Econometrics and Finance",8,2,Social Sciences,1
14334,HIV/AIDS Impact and Responses,"Economics, Econometrics and Finance",8,2,Social Sciences,1
14370,"Economic, Social, and Health Studies","Economics, Econometrics and Finance",8,2,Social Sciences,1
14404,European Socioeconomic and Political Studies,"Economics, Econometrics and Finance",8,2,Social Sciences,1
14424,Economic Analysis and Policy,"Economics, Econometrics and Finance",8,2,Social Sciences,1
14467,"Public Administration, ICT, and Policy Development","Economics, Econometrics and Finance",8,2,Social Sciences,1
14491,Diverse academic and cultural studies,"Economics, Econometrics and Finance",8,2,Social Sciences,1
14501,Global Economic and Social Development,"Economics, Econometrics and Finance",8,2,Social Sciences,1
14503,"Globalization, Economics, and Policies","Economics, Econometrics and Finance",8,2,Social Sciences,1
10047,Financial Markets and Investment Strategies,"Economics, Econometrics and Finance",8,2,Social Sciences,1
10067,Stochastic processes and financial applications,"Economics, Econometrics and Finance",8,2,Social Sciences,1
10127,"Banking stability, regulation, efficiency","Economics, Econometrics and Finance",8,2,Social Sciences,1
10282,Financial Risk and Volatility Modeling,"Economics, Econometrics and Finance",8,2,Social Sciences,1
10503,Global Financial Crisis and Policies,"Economics, Econometrics and Finance",8,2,Social Sciences,1
11496,Credit Risk and Financial Regulations,"Economics, Econometrics and Finance",8,2,Social Sciences,1
11531,Healthcare Systems and Reforms,"Economics, Econometrics and Finance",8,2,Social Sciences,1
11817,"Housing, Finance, and Neoliberalism","Economics, Econometrics and Finance",8,2,Social Sciences,1
11976,Capital Investment and Risk Analysis,"Economics, Econometrics and Finance",8,2,Social Sciences,1
13074,Global Financial Regulation and Crises,"Economics, Econometrics and Finance",8,2,Social Sciences,1
13146,Sustainable Finance and Green Bonds,"Economics, Econometrics and Finance",8,2,Social Sciences,1
14101,Financial Crisis of the 21st Century,"Economics, Econometrics and Finance",8,2,Social Sciences,1
14154,"finance, banking, and market dynamics","Economics, Econometrics and Finance",8,2,Social Sciences,1
14166,European Monetary and Fiscal Policies,"Economics, Econometrics and Finance",8,2,Social Sciences,1
14317,"Finance, Markets, and Regulation","Economics, Econometrics and Finance",8,2,Social Sciences,1
14464,Community Development and Social Impact,"Economics, Econometrics and Finance",8,2,Social Sciences,1
12430,Academic and Historical Perspectives in Psychology,Psychology,9,2,Social Sciences,1
11519,Digital Mental Health Interventions,Psychology,9,2,Social Sciences,1
11542,Behavioral Health and Interventions,Psychology,9,2,Social Sciences,1
11994,Human Resource Development and Performance Evaluation,Psychology,9,2,Social Sciences,1
12485,"Optimism, Hope, and Well-being",Psychology,9,2,Social Sciences,1
12787,Human Behavior and Motivation,Psychology,9,2,Social Sciences,1
12848,Psychological Testing and Assessment,Psychology,9,2,Social Sciences,1
13821,Coaching Methods and Impact,Psychology,9,2,Social Sciences,1
10168,COVID-19 and Mental Health,Psychology,9,2,Social Sciences,1
10182,Child and Adolescent Psychosocial and Emotional Development,Psychology,9,2,Social Sciences,1
10214,Psychotherapy Techniques and Applications,Psychology,9,2,Social Sciences,1
10242,Posttraumatic Stress Disorder Research,Psychology,9,2,Social Sciences,1
10263,Eating Disorders and Behaviors,Psychology,9,2,Social Sciences,1
10376,Suicide and Self-Harm Studies,Psychology,9,2,Social Sciences,1
10426,Child Abuse and Trauma,Psychology,9,2,Social Sciences,1
10565,"Psychopathy, Forensic Psychiatry, Sexual Offending",Psychology,9,2,Social Sciences,1
10708,Mindfulness and Compassion Interventions,Psychology,9,2,Social Sciences,1
10762,"Migration, Health and Trauma",Psychology,9,2,Social Sciences,1
11040,Personality Traits and Psychology,Psychology,9,2,Social Sciences,1
11093,Personality Disorders and Psychopathology,Psychology,9,2,Social Sciences,1
11123,Obsessive-Compulsive Spectrum Disorders,Psychology,9,2,Social Sciences,1
11132,Psychoanalysis and Psychopathology Research,Psychology,9,2,Social Sciences,1
11388,"Grief, Bereavement, and Mental Health",Psychology,9,2,Social Sciences,1
11632,Family and Disability Support Research,Psychology,9,2,Social Sciences,1
11678,Healthcare Decision-Making and Restraints,Psychology,9,2,Social Sciences,1
11705,Gambling Behavior and Treatments,Psychology,9,2,Social Sciences,1
11761,Resilience and Mental Health,Psychology,9,2,Social Sciences,1
12245,"Counseling, Therapy, and Family Dynamics",Psychology,9,2,Social Sciences,1
12258,"Perfectionism, Procrastination, Anxiety Studies",Psychology,9,2,Social Sciences,1
12335,"Sexuality, Behavior, and Technology",Psychology,9,2,Social Sciences,1
12553,Psychedelics and Drug Studies,Psychology,9,2,Social Sciences,1
12663,Body Image and Dysmorphia Studies,Psychology,9,2,Social Sciences,1
12666,Historical Psychiatry and Medical Practices,Psychology,9,2,Social Sciences,1
12684,Stuttering Research and Treatment,Psychology,9,2,Social Sciences,1
12844,Psychology and Mental Health,Psychology,9,2,Social Sciences,1
12889,"Psychoanalysis, Philosophy, and Politics",Psychology,9,2,Social Sciences,1
12980,Family Caregiving in Mental Illness,Psychology,9,2,Social Sciences,1
13118,Psychological Treatments and Disorders,Psychology,9,2,Social Sciences,1
13143,Child Therapy and Development,Psychology,9,2,Social Sciences,1
13262,Semiotics and Cultural Interpretation,Psychology,9,2,Social Sciences,1
13272,Psychological Treatments and Assessments,Psychology,9,2,Social Sciences,1
13419,Ego Development and Educational Practices,Psychology,9,2,Social Sciences,1
13782,Transactional Analysis in Psychotherapy,Psychology,9,2,Social Sciences,1
13944,Psychiatric care and mental health services,Psychology,9,2,Social Sciences,1
14313,Health and Well-being Studies,Psychology,9,2,Social Sciences,1
14434,Historical and Modern Theater Studies,Psychology,9,2,Social Sciences,1
10103,Reading and Literacy Development,Psychology,9,2,Social Sciences,1
10636,Innovative Teaching and Learning Methods,Psychology,9,2,Social Sciences,1
10656,Child and Animal Learning Development,Psychology,9,2,Social Sciences,1
10730,Language Development and Disorders,Psychology,9,2,Social Sciences,1
10731,Educational Games and Gamification,Psychology,9,2,Social Sciences,1
10813,Sport Psychology and Performance,Psychology,9,2,Social Sciences,1
10826,Behavioral and Psychological Studies,Psychology,9,2,Social Sciences,1
11285,Hearing Impairment and Communication,Psychology,9,2,Social Sciences,1
11587,Second Language Acquisition and Learning,Psychology,9,2,Social Sciences,1
11820,Learning Styles and Cognitive Differences,Psychology,9,2,Social Sciences,1
11983,"Identity, Memory, and Therapy",Psychology,9,2,Social Sciences,1
12241,Children's Physical and Motor Development,Psychology,9,2,Social Sciences,1
12887,Educational Strategies and Epistemologies,Psychology,9,2,Social Sciences,1
12993,Psychology of Development and Education,Psychology,9,2,Social Sciences,1
13353,Flow Experience in Various Fields,Psychology,9,2,Social Sciences,1
13447,Educational and Psychological Assessments,Psychology,9,2,Social Sciences,1
13600,Science Education and Perceptions,Psychology,9,2,Social Sciences,1
14085,Student Stress and Coping,Psychology,9,2,Social Sciences,1
14301,Educational methodologies and cognitive development,Psychology,9,2,Social Sciences,1
14485,Language Acquisition and Education,Psychology,9,2,Social Sciences,1
10258,Philosophy and Theoretical Science,Psychology,9,2,Social Sciences,1
10316,Sleep and related disorders,Psychology,9,2,Social Sciences,1
10403,Phonetics and Phonology Research,Psychology,9,2,Social Sciences,1
10547,"Education, Achievement, and Giftedness",Psychology,9,2,Social Sciences,1
10667,Emotion and Mood Recognition,Psychology,9,2,Social Sciences,1
10853,"Anxiety, Depression, Psychometrics, Treatment, Cognitive Processes",Psychology,9,2,Social Sciences,1
11079,Creativity in Education and Neuroscience,Psychology,9,2,Social Sciences,1
11118,Evolutionary Psychology and Human Behavior,Psychology,9,2,Social Sciences,1
11148,"Language, Metaphor, and Cognition",Psychology,9,2,Social Sciences,1
11373,Sleep and Work-Related Fatigue,Psychology,9,2,Social Sciences,1
11516,Visual and Cognitive Learning Processes,Psychology,9,2,Social Sciences,1
11577,Cognitive Abilities and Testing,Psychology,9,2,Social Sciences,1
11592,Phenomenology and Existential Philosophy,Psychology,9,2,Social Sciences,1
12032,Multisensory perception and integration,Psychology,9,2,Social Sciences,1
12051,Diversity and Impact of Dance,Psychology,9,2,Social Sciences,1
12694,"Categorization, perception, and language",Psychology,9,2,Social Sciences,1
12757,Diverse Academia and Research Topics,Psychology,9,2,Social Sciences,1
13211,"Memory, Trauma, and Testimony",Psychology,9,2,Social Sciences,1
13283,Mental Health Research Topics,Psychology,9,2,Social Sciences,1
13284,Psychology Research and Bibliometrics,Psychology,9,2,Social Sciences,1
13380,Sound Studies and Aurality,Psychology,9,2,Social Sciences,1
13471,Cognitive Functions and Memory,Psychology,9,2,Social Sciences,1
13536,Psychological and Temporal Perspectives Research,Psychology,9,2,Social Sciences,1
14308,Psychological and Educational Research Studies,Psychology,9,2,Social Sciences,1
11265,Aging and Gerontology Research,Psychology,9,2,Social Sciences,1
14104,Developmental and Educational Neuropsychology,Psychology,9,2,Social Sciences,1
10156,"LGBTQ Health, Identity, and Policy",Psychology,9,2,Social Sciences,1
10272,Mental Health Treatment and Access,Psychology,9,2,Social Sciences,1
10475,Psychological Well-being and Life Satisfaction,Psychology,9,2,Social Sciences,1
10485,"Bullying, Victimization, and Aggression",Psychology,9,2,Social Sciences,1
10525,Human-Automation Interaction and Safety,Psychology,9,2,Social Sciences,1
10677,Attachment and Relationship Dynamics,Psychology,9,2,Social Sciences,1
10699,Primate Behavior and Ecology,Psychology,9,2,Social Sciences,1
10709,Social Robot Interaction and HRI,Psychology,9,2,Social Sciences,1
10970,Team Dynamics and Performance,Psychology,9,2,Social Sciences,1
11104,"Memory, Trauma, and Commemoration",Psychology,9,2,Social Sciences,1
11295,Counseling Practices and Supervision,Psychology,9,2,Social Sciences,1
11400,Motivation and Self-Concept in Sports,Psychology,9,2,Social Sciences,1
11431,Action Observation and Synchronization,Psychology,9,2,Social Sciences,1
11433,Emotional Intelligence and Performance,Psychology,9,2,Social Sciences,1
11454,Cultural Differences and Values,Psychology,9,2,Social Sciences,1
11541,Neuroendocrine regulation and behavior,Psychology,9,2,Social Sciences,1
11756,Mentoring and Academic Development,Psychology,9,2,Social Sciences,1
11768,Music Therapy and Health,Psychology,9,2,Social Sciences,1
11793,"Recreation, Leisure, Wilderness Management",Psychology,9,2,Social Sciences,1
11795,Humor Studies and Applications,Psychology,9,2,Social Sciences,1
12006,Ergonomics and Musculoskeletal Disorders,Psychology,9,2,Social Sciences,1
12175,Social Representations and Identity,Psychology,9,2,Social Sciences,1
12256,Facilities and Workplace Management,Psychology,9,2,Social Sciences,1
12268,Deception detection and forensic psychology,Psychology,9,2,Social Sciences,1
12313,Emotions and Moral Behavior,Psychology,9,2,Social Sciences,1
12448,Paranormal Experiences and Beliefs,Psychology,9,2,Social Sciences,1
12488,Mental Health via Writing,Psychology,9,2,Social Sciences,1
12493,"Memory, violence, and history",Psychology,9,2,Social Sciences,1
12496,Color perception and design,Psychology,9,2,Social Sciences,1
12521,Death Anxiety and Social Exclusion,Psychology,9,2,Social Sciences,1
12551,Forgiveness and Related Behaviors,Psychology,9,2,Social Sciences,1
12593,Communication in Education and Healthcare,Psychology,9,2,Social Sciences,1
12704,Stress and Burnout Research,Psychology,9,2,Social Sciences,1
12753,"Psychology, Coaching, and Therapy",Psychology,9,2,Social Sciences,1
12802,Competency Development and Evaluation,Psychology,9,2,Social Sciences,1
12882,Jungian Analytical Psychology,Psychology,9,2,Social Sciences,1
12997,Outdoor and Experiential Education,Psychology,9,2,Social Sciences,1
13060,Adventure Sports and Sensation Seeking,Psychology,9,2,Social Sciences,1
13435,Animal and Plant Science Education,Psychology,9,2,Social Sciences,1
13510,Nostalgia and Consumer Behavior,Psychology,9,2,Social Sciences,1
13542,"Grit, Self-Efficacy, and Motivation",Psychology,9,2,Social Sciences,1
13585,Technostress in Professional Settings,Psychology,9,2,Social Sciences,1
13777,Cognitive and psychological constructs research,Psychology,9,2,Social Sciences,1
13829,"Health, Work, and Social Studies in Poland",Psychology,9,2,Social Sciences,1
13968,Contemporary Cultural and Social Studies,Psychology,9,2,Social Sciences,1
14045,"Health, Education, and Physical Culture",Psychology,9,2,Social Sciences,1
14056,Safety Warnings and Signage,Psychology,9,2,Social Sciences,1
14173,"Education, Healthcare and Sociology Research",Psychology,9,2,Social Sciences,1
14220,"Workaholism, burnout, and well-being",Psychology,9,2,Social Sciences,1
14229,Physical education and sports games research,Psychology,9,2,Social Sciences,1
14295,Families in Therapy and Culture,Psychology,9,2,Social Sciences,1
14513,"Leadership, Courage, and Heroism Studies",Psychology,9,2,Social Sciences,1
12877,Social Issues in Poland,Social Sciences,10,2,Social Sciences,1
12913,Multidisciplinary Research Papers Compilation,Social Sciences,10,2,Social Sciences,1
13041,Contemporary Social and Economic Issues,Social Sciences,10,2,Social Sciences,1
13066,Information Society and Technology Trends,Social Sciences,10,2,Social Sciences,1
13586,"HIV, TB, and STIs Epidemiology",Social Sciences,10,2,Social Sciences,1
13624,Social Sciences and Policies,Social Sciences,10,2,Social Sciences,1
13671,Philosophy and Phenomenology Studies,Social Sciences,10,2,Social Sciences,1
13765,Social Science and Policy Research,Social Sciences,10,2,Social Sciences,1
13910,Computational and Text Analysis Methods,Social Sciences,10,2,Social Sciences,1
14087,"Economic, Educational, Environmental and Organizational Development",Social Sciences,10,2,Social Sciences,1
14107,Appalachian Studies and Mathematics,Social Sciences,10,2,Social Sciences,1
14198,Philosophical Thought and Analysis,Social Sciences,10,2,Social Sciences,1
14228,Religion and Sociopolitical Dynamics in Nigeria,Social Sciences,10,2,Social Sciences,1
14340,Islamic Social Reporting,Social Sciences,10,2,Social Sciences,1
14371,Hume's philosophy and hair distribution,Social Sciences,10,2,Social Sciences,1
14375,"Cultural, Linguistic, Economic Studies",Social Sciences,10,2,Social Sciences,1
13256,Archaeology and Rock Art Studies,Social Sciences,10,2,Social Sciences,1
13742,Metallurgy and Cultural Artifacts,Social Sciences,10,2,Social Sciences,1
11168,International Development and Aid,Social Sciences,10,2,Social Sciences,1
12490,Software Engineering and Design Patterns,Social Sciences,10,2,Social Sciences,1
12636,Regional Development and Innovation,Social Sciences,10,2,Social Sciences,1
12667,Economic and Technological Developments in Russia,Social Sciences,10,2,Social Sciences,1
14027,21st Century Education and Governance,Social Sciences,10,2,Social Sciences,1
14044,Medical and Agricultural Research Studies,Social Sciences,10,2,Social Sciences,1
14218,Engineering Education and Global Impact,Social Sciences,10,2,Social Sciences,1
14418,"Development, Ethics, and Society",Social Sciences,10,2,Social Sciences,1
10008,Teacher Education and Leadership Studies,Social Sciences,10,2,Social Sciences,1
10072,Science Education and Pedagogy,Social Sciences,10,2,Social Sciences,1
10130,Mathematics Education and Teaching Techniques,Social Sciences,10,2,Social Sciences,1
10162,Online and Blended Learning,Social Sciences,10,2,Social Sciences,1
10267,Higher Education Research Studies,Social Sciences,10,2,Social Sciences,1
10437,Educational theories and practices,Social Sciences,10,2,Social Sciences,1
10457,Education Pedagogy and Practices,Social Sciences,10,2,Social Sciences,1
10561,Educational Research and Methods,Social Sciences,10,2,Social Sciences,1
