topic_id,topic_name,field_name,field_id_scaled,domain_id,domain_name,domain_id_scaled
12510,Magneto-Optical Properties and Applications,Engineering,16,3,Physical Sciences,2
12692,Magnetic Field Sensors Techniques,Engineering,16,3,Physical Sciences,2
12737,Electrical Fault Detection and Protection,Engineering,16,3,Physical Sciences,2
12760,Laser Design and Applications,Engineering,16,3,Physical Sciences,2
12776,Electrohydrodynamics and Fluid Dynamics,Engineering,16,3,Physical Sciences,2
12791,Full-Duplex Wireless Communications,Engineering,16,3,Physical Sciences,2
12808,Ferroelectric and Negative Capacitance Devices,Engineering,16,3,Physical Sciences,2
12899,Engineering and Technology Innovations,Engineering,16,3,Physical Sciences,2
13046,Electrokinetic Soil Remediation Techniques,Engineering,16,3,Physical Sciences,2
13093,Electric Power Systems and Control,Engineering,16,3,Physical Sciences,2
13183,Islanding Detection in Power Systems,Engineering,16,3,Physical Sciences,2
13251,Electrical and Thermal Properties of Materials,Engineering,16,3,Physical Sciences,2
13292,Embedded Systems and FPGA Applications,Engineering,16,3,Physical Sciences,2
13420,Arduino and IoT Applications,Engineering,16,3,Physical Sciences,2
13429,Electricity Theft Detection Techniques,Engineering,16,3,Physical Sciences,2
13436,Space Technology and Applications,Engineering,16,3,Physical Sciences,2
13440,Electromagnetic Effects on Materials,Engineering,16,3,Physical Sciences,2
13816,Advanced Signal Processing Techniques,Engineering,16,3,Physical Sciences,2
13856,Advanced Power Generation Technologies,Engineering,16,3,Physical Sciences,2
13918,Advanced Data and IoT Technologies,Engineering,16,3,Physical Sciences,2
14117,Integrated Circuits and Semiconductor Failure Analysis,Engineering,16,3,Physical Sciences,2
14158,Optical Systems and Laser Technology,Engineering,16,3,Physical Sciences,2
14257,Advanced Measurement and Detection Methods,Engineering,16,3,Physical Sciences,2
14276,Power Systems and Technologies,Engineering,16,3,Physical Sciences,2
14382,Electrophoretic Deposition in Materials Science,Engineering,16,3,Physical Sciences,2
14502,High-Voltage Power Transmission Systems,Engineering,16,3,Physical Sciences,2
10551,Scheduling and Optimization Algorithms,Engineering,16,3,Physical Sciences,2
10567,Vehicle Routing Optimization Methods,Engineering,16,3,Physical Sciences,2
10763,Digital Transformation in Industry,Engineering,16,3,Physical Sciences,2
11159,Manufacturing Process and Optimization,Engineering,16,3,Physical Sciences,2
11223,Maritime Ports and Logistics,Engineering,16,3,Physical Sciences,2
11568,Railway Systems and Energy Efficiency,Engineering,16,3,Physical Sciences,2
11741,Flexible and Reconfigurable Manufacturing Systems,Engineering,16,3,Physical Sciences,2
11814,Advanced Manufacturing and Logistics Optimization,Engineering,16,3,Physical Sciences,2
12111,Industrial Vision Systems and Defect Detection,Engineering,16,3,Physical Sciences,2
12176,Optimization and Packing Problems,Engineering,16,3,Physical Sciences,2
12746,Sustainable Industrial Ecology,Engineering,16,3,Physical Sciences,2
12782,Assembly Line Balancing Optimization,Engineering,16,3,Physical Sciences,2
12984,Transport and Logistics Innovations,Engineering,16,3,Physical Sciences,2
13027,Applied Advanced Technologies,Engineering,16,3,Physical Sciences,2
13113,Engineering Technology and Methodologies,Engineering,16,3,Physical Sciences,2
13287,Robotic Process Automation Applications,Engineering,16,3,Physical Sciences,2
13290,Diverse Industrial Engineering Technologies,Engineering,16,3,Physical Sciences,2
10188,Advanced machining processes and optimization,Engineering,16,3,Physical Sciences,2
10386,Microstructure and Mechanical Properties of Steels,Engineering,16,3,Physical Sciences,2
10568,Thermodynamic and Exergetic Analyses of Power and Cooling Systems,Engineering,16,3,Physical Sciences,2
10633,Metallic Glasses and Amorphous Alloys,Engineering,16,3,Physical Sciences,2
10635,Hydraulic Fracturing and Reservoir Analysis,Engineering,16,3,Physical Sciences,2
10672,Design Education and Practice,Engineering,16,3,Physical Sciences,2
10700,Metal Forming Simulation Techniques,Engineering,16,3,Physical Sciences,2
10705,Additive Manufacturing Materials and Processes,Engineering,16,3,Physical Sciences,2
10707,Cellular and Composite Structures,Engineering,16,3,Physical Sciences,2
10717,Aluminum Alloys Composites Properties,Engineering,16,3,Physical Sciences,2
10723,Advanced Welding Techniques Analysis,Engineering,16,3,Physical Sciences,2
10834,Welding Techniques and Residual Stresses,Engineering,16,3,Physical Sciences,2
10840,High Temperature Alloys and Creep,Engineering,16,3,Physical Sciences,2
10842,Railway Engineering and Dynamics,Engineering,16,3,Physical Sciences,2
10850,Heat Transfer and Boiling Studies,Engineering,16,3,Physical Sciences,2
10938,Phase Change Materials Research,Engineering,16,3,Physical Sciences,2
10967,Carbon Dioxide Capture Technologies,Engineering,16,3,Physical Sciences,2
10998,Heat Transfer and Optimization,Engineering,16,3,Physical Sciences,2
11062,Gear and Bearing Dynamics Analysis,Engineering,16,3,Physical Sciences,2
11091,Extraction and Separation Processes,Engineering,16,3,Physical Sciences,2
11100,Intermetallics and Advanced Alloy Properties,Engineering,16,3,Physical Sciences,2
11126,Metallurgical Processes and Thermodynamics,Engineering,16,3,Physical Sciences,2
11138,Tribology and Lubrication Engineering,Engineering,16,3,Physical Sciences,2
11143,High Entropy Alloys Studies,Engineering,16,3,Physical Sciences,2
11145,Epoxy Resin Curing Processes,Engineering,16,3,Physical Sciences,2
11230,Innovative Energy Harvesting Technologies,Engineering,16,3,Physical Sciences,2
11351,Catalysis and Hydrodesulfurization Studies,Engineering,16,3,Physical Sciences,2
11362,Membrane Separation and Gas Transport,Engineering,16,3,Physical Sciences,2
11372,Hydraulic and Pneumatic Systems,Engineering,16,3,Physical Sciences,2
11529,Refrigeration and Air Conditioning Technologies,Engineering,16,3,Physical Sciences,2
11557,Lubricants and Their Additives,Engineering,16,3,Physical Sciences,2
11583,Advanced Measurement and Metrology Techniques,Engineering,16,3,Physical Sciences,2
11664,Fiber-reinforced polymer composites,Engineering,16,3,Physical Sciences,2
11687,Teleoperation and Haptic Systems,Engineering,16,3,Physical Sciences,2
11737,Advanced Materials and Mechanics,Engineering,16,3,Physical Sciences,2
11774,Adsorption and Cooling Systems,Engineering,16,3,Physical Sciences,2
11837,Iron and Steelmaking Processes,Engineering,16,3,Physical Sciences,2
11945,Heat Transfer Mechanisms,Engineering,16,3,Physical Sciences,2
12080,Injection Molding Process and Properties,Engineering,16,3,Physical Sciences,2
12086,Structural Integrity and Reliability Analysis,Engineering,16,3,Physical Sciences,2
12099,Advanced materials and composites,Engineering,16,3,Physical Sciences,2
12106,Surface Treatment and Residual Stress,Engineering,16,3,Physical Sciences,2
12139,Advanced Thermodynamic Systems and Engines,Engineering,16,3,Physical Sciences,2
12169,Non-Destructive Testing Techniques,Engineering,16,3,Physical Sciences,2
12201,Agricultural Engineering and Mechanization,Engineering,16,3,Physical Sciences,2
12282,Mineral Processing and Grinding,Engineering,16,3,Physical Sciences,2
12371,Electrical Contact Performance and Analysis,Engineering,16,3,Physical Sciences,2
12406,IoT and GPS-based Vehicle Safety Systems,Engineering,16,3,Physical Sciences,2
12425,Industrial Gas Emission Control,Engineering,16,3,Physical Sciences,2
12581,Engineering Structural Analysis Methods,Engineering,16,3,Physical Sciences,2
12729,Tree Root and Stability Studies,Engineering,16,3,Physical Sciences,2
12774,Bauxite Residue and Utilization,Engineering,16,3,Physical Sciences,2
12784,Modular Robots and Swarm Intelligence,Engineering,16,3,Physical Sciences,2
12897,Structural Analysis of Composite Materials,Engineering,16,3,Physical Sciences,2
12898,Induction Heating and Inverter Technology,Engineering,16,3,Physical Sciences,2
12907,Mechanical Engineering and Vibrations Research,Engineering,16,3,Physical Sciences,2
12932,Powder Metallurgy Techniques and Materials,Engineering,16,3,Physical Sciences,2
12959,Engineering and Materials Science Studies,Engineering,16,3,Physical Sciences,2
13020,Heat Transfer and Mathematical Modeling,Engineering,16,3,Physical Sciences,2
13045,Industrial Engineering and Technologies,Engineering,16,3,Physical Sciences,2
13094,Mining and Gasification Technologies,Engineering,16,3,Physical Sciences,2
13140,Materials Engineering and Processing,Engineering,16,3,Physical Sciences,2
13213,Mechanical Failure Analysis and Simulation,Engineering,16,3,Physical Sciences,2
13298,Solar Energy Systems and Technologies,Engineering,16,3,Physical Sciences,2
13312,Mechanical and Thermal Properties Analysis,Engineering,16,3,Physical Sciences,2
13341,Belt Conveyor Systems Engineering,Engineering,16,3,Physical Sciences,2
13451,Mechanical Engineering Research and Applications,Engineering,16,3,Physical Sciences,2
13470,Surface Treatment and Coatings,Engineering,16,3,Physical Sciences,2
13584,Coal Combustion and Slurry Processing,Engineering,16,3,Physical Sciences,2
13640,Ranque-Hilsch vortex tube,Engineering,16,3,Physical Sciences,2
13644,Control Systems in Engineering,Engineering,16,3,Physical Sciences,2
13645,Thermodynamic and Structural Properties of Metals and Alloys,Engineering,16,3,Physical Sciences,2
13685,Material Science and Thermodynamics,Engineering,16,3,Physical Sciences,2
13715,Power Line Inspection Robots,Engineering,16,3,Physical Sciences,2
13790,Waste Management and Environmental Impact,Engineering,16,3,Physical Sciences,2
13827,Mechatronics Education and Applications,Engineering,16,3,Physical Sciences,2
14096,Advancements in Materials Engineering,Engineering,16,3,Physical Sciences,2
14304,Transport Systems and Technology,Engineering,16,3,Physical Sciences,2
14454,Polymer Science and Applications,Engineering,16,3,Physical Sciences,2
10161,Rock Mechanics and Modeling,Engineering,16,3,Physical Sciences,2
10219,Mechanical Behavior of Composites,Engineering,16,3,Physical Sciences,2
10221,Composite Structure Analysis and Optimization,Engineering,16,3,Physical Sciences,2
10377,Metal and Thin Film Mechanics,Engineering,16,3,Physical Sciences,2
10396,Fatigue and fracture mechanics,Engineering,16,3,Physical Sciences,2
10399,Hydrocarbon exploration and reservoir analysis,Engineering,16,3,Physical Sciences,2
10514,Numerical methods in engineering,Engineering,16,3,Physical Sciences,2
10662,Ultrasonics and Acoustic Wave Propagation,Engineering,16,3,Physical Sciences,2
10806,Energetic Materials and Combustion,Engineering,16,3,Physical Sciences,2
11201,Metallurgy and Material Forming,Engineering,16,3,Physical Sciences,2
11202,Cavitation Phenomena in Pumps,Engineering,16,3,Physical Sciences,2
11558,Composite Material Mechanics,Engineering,16,3,Physical Sciences,2
11565,Thermoelastic and Magnetoelastic Phenomena,Engineering,16,3,Physical Sciences,2
11799,"Adhesion, Friction, and Surface Interactions",Engineering,16,3,Physical Sciences,2
11854,Laser-induced spectroscopy and plasma,Engineering,16,3,Physical Sciences,2
11856,Thermography and Photoacoustic Techniques,Engineering,16,3,Physical Sciences,2
12118,Forest Biomass Utilization and Management,Engineering,16,3,Physical Sciences,2
12252,Mechanical stress and fatigue analysis,Engineering,16,3,Physical Sciences,2
12362,Tribology and Wear Analysis,Engineering,16,3,Physical Sciences,2
12537,Flow Measurement and Analysis,Engineering,16,3,Physical Sciences,2
12579,Muon and positron interactions and applications,Engineering,16,3,Physical Sciences,2
12971,Material Properties and Processing,Engineering,16,3,Physical Sciences,2
13261,Elasticity and Wave Propagation,Engineering,16,3,Physical Sciences,2
13619,Geotechnical and Geomechanical Engineering,Engineering,16,3,Physical Sciences,2
13772,Geomechanics and Mining Engineering,Engineering,16,3,Physical Sciences,2
13862,"Soil, Finite Element Methods",Engineering,16,3,Physical Sciences,2
13891,Engineering Diagnostics and Reliability,Engineering,16,3,Physical Sciences,2
14204,Railway Systems and Materials Science,Engineering,16,3,Physical Sciences,2
14479,Freezing and Crystallization Processes,Engineering,16,3,Physical Sciences,2
10491,Enhanced Oil Recovery Techniques,Engineering,16,3,Physical Sciences,2
10892,Drilling and Well Engineering,Engineering,16,3,Physical Sciences,2
10969,Water resources management and optimization,Engineering,16,3,Physical Sciences,2
11192,Underwater Vehicles and Communication Systems,Engineering,16,3,Physical Sciences,2
11250,Wave and Wind Energy Systems,Engineering,16,3,Physical Sciences,2
11284,Coal Properties and Utilization,Engineering,16,3,Physical Sciences,2
11500,Evacuation and Crowd Dynamics,Engineering,16,3,Physical Sciences,2
11604,Ship Hydrodynamics and Maneuverability,Engineering,16,3,Physical Sciences,2
11609,Geophysical Methods and Applications,Engineering,16,3,Physical Sciences,2
11622,Maritime Navigation and Safety,Engineering,16,3,Physical Sciences,2
11801,Reservoir Engineering and Simulation Methods,Engineering,16,3,Physical Sciences,2
12071,Marine Biology and Environmental Chemistry,Engineering,16,3,Physical Sciences,2
12350,Particle Dynamics in Fluid Flows,Engineering,16,3,Physical Sciences,2
12983,Satellite Image Processing and Photogrammetry,Engineering,16,3,Physical Sciences,2
13050,Oil and Gas Production Techniques,Engineering,16,3,Physical Sciences,2
13190,Engineering and Environmental Studies,Engineering,16,3,Physical Sciences,2
13282,Automated Road and Building Extraction,Engineering,16,3,Physical Sciences,2
13578,Stonefly species taxonomy and ecology,Engineering,16,3,Physical Sciences,2
13885,Geophysics and Sensor Technology,Engineering,16,3,Physical Sciences,2
13925,Offshore Engineering and Technologies,Engineering,16,3,Physical Sciences,2
14164,Marine and Offshore Engineering Studies,Engineering,16,3,Physical Sciences,2
14359,Wetland Management and Conservation,Engineering,16,3,Physical Sciences,2
14412,Marine and Coastal Research,Engineering,16,3,Physical Sciences,2
10370,Traffic and Road Safety,Engineering,16,3,Physical Sciences,2
10780,Reliability and Maintenance Optimization,Engineering,16,3,Physical Sciences,2
11046,Geotechnical Engineering and Analysis,Engineering,16,3,Physical Sciences,2
11317,Fire dynamics and safety research,Engineering,16,3,Physical Sciences,2
11941,Power System Reliability and Maintenance,Engineering,16,3,Physical Sciences,2
12597,Fire Detection and Safety Systems,Engineering,16,3,Physical Sciences,2
13295,Safety Systems Engineering in Autonomy,Engineering,16,3,Physical Sciences,2
13923,Nuclear and radioactivity studies,Engineering,16,3,Physical Sciences,2
14091,Industrial and Mining Safety,Engineering,16,3,Physical Sciences,2
14306,Technology Assessment and Management,Engineering,16,3,Physical Sciences,2
14368,Evaluation and Optimization Models,Engineering,16,3,Physical Sciences,2
14392,Geoscience and Mining Technology,Engineering,16,3,Physical Sciences,2
10689,Remote-Sensing Image Classification,Engineering,16,3,Physical Sciences,2
10986,RFID technology advancements,Engineering,16,3,Physical Sciences,2
11283,Experimental Learning in Engineering,Engineering,16,3,Physical Sciences,2
11408,Advanced Optical Imaging Technologies,Engineering,16,3,Physical Sciences,2
11479,Smart Cities and Technologies,Engineering,16,3,Physical Sciences,2
11499,ICT Impact and Policies,Engineering,16,3,Physical Sciences,2
11659,Advanced Image Fusion Techniques,Engineering,16,3,Physical Sciences,2
12124,Engineering Education and Curriculum Development,Engineering,16,3,Physical Sciences,2
12707,Vehicle License Plate Recognition,Engineering,16,3,Physical Sciences,2
13114,Image Processing Techniques and Applications,Engineering,16,3,Physical Sciences,2
13905,Telecommunications and Broadcasting Technologies,Engineering,16,3,Physical Sciences,2
14145,Diverse Cultural Media Analysis,Engineering,16,3,Physical Sciences,2
10121,Building Energy and Comfort Optimization,Engineering,16,3,Physical Sciences,2
10284,Anaerobic Digestion and Biogas Production,Engineering,16,3,Physical Sciences,2
10479,Structural Behavior of Reinforced Concrete,Engineering,16,3,Physical Sciences,2
10484,Wood Treatment and Properties,Engineering,16,3,Physical Sciences,2
11006,BIM and Construction Integration,Engineering,16,3,Physical Sciences,2
11344,Traffic Prediction and Management Techniques,Engineering,16,3,Physical Sciences,2
11511,Dyeing and Modifying Textile Fibers,Engineering,16,3,Physical Sciences,2
11672,Recycling and utilization of industrial and municipal waste in materials production,Engineering,16,3,Physical Sciences,2
11847,Recycled Aggregate Concrete Performance,Engineering,16,3,Physical Sciences,2
11933,Mining and Resource Management,Engineering,16,3,Physical Sciences,2
11988,Sustainable Building Design and Assessment,Engineering,16,3,Physical Sciences,2
12105,Hygrothermal properties of building materials,Engineering,16,3,Physical Sciences,2
12190,Innovations in Concrete and Construction Materials,Engineering,16,3,Physical Sciences,2
12239,Construction Management and Sustainability,Engineering,16,3,Physical Sciences,2
12306,Urban and Freight Transport Logistics,Engineering,16,3,Physical Sciences,2
12325,Urban Design and Spatial Analysis,Engineering,16,3,Physical Sciences,2
12546,Smart Parking Systems Research,Engineering,16,3,Physical Sciences,2
12698,3D Modeling in Geospatial Applications,Engineering,16,3,Physical Sciences,2
13263,Building energy efficiency and sustainability,Engineering,16,3,Physical Sciences,2
13477,Sustainable Design and Development,Engineering,16,3,Physical Sciences,2
13689,Underground infrastructure and sustainability,Engineering,16,3,Physical Sciences,2
14456,Blasting Impact and Analysis,Engineering,16,3,Physical Sciences,2
12188,"Architecture, Modernity, and Design",Engineering,16,3,Physical Sciences,2
13518,Architecture and Computational Design,Engineering,16,3,Physical Sciences,2
13682,Engineering Education and Pedagogy,Engineering,16,3,Physical Sciences,2
14390,Real estate and construction management,Engineering,16,3,Physical Sciences,2
10895,Species Distribution and Climate Change,Environmental Science,17,3,Physical Sciences,2
12092,Erosion and Abrasive Machining,Environmental Science,17,3,Physical Sciences,2
13955,Evaluation Methods in Various Fields,Environmental Science,17,3,Physical Sciences,2
10089,Avian ecology and behavior,Environmental Science,17,3,Physical Sciences,2
10111,Remote Sensing in Agriculture,Environmental Science,17,3,Physical Sciences,2
10199,Wildlife Ecology and Conservation,Environmental Science,17,3,Physical Sciences,2
10341,Coral and Marine Ecosystems Studies,Environmental Science,17,3,Physical Sciences,2
10577,Hydrology and Sediment Transport Processes,Environmental Science,17,3,Physical Sciences,2
10659,Marine animal studies overview,Environmental Science,17,3,Physical Sciences,2
10669,Freshwater macroinvertebrate diversity and ecology,Environmental Science,17,3,Physical Sciences,2
10779,Coastal wetland ecosystem dynamics,Environmental Science,17,3,Physical Sciences,2
10815,Parasite Biology and Host Interactions,Environmental Science,17,3,Physical Sciences,2
11004,Crustacean biology and ecology,Environmental Science,17,3,Physical Sciences,2
11048,Bacteriophages and microbial interactions,Environmental Science,17,3,Physical Sciences,2
11056,Physiological and biochemical adaptations,Environmental Science,17,3,Physical Sciences,2
11259,Agriculture Sustainability and Environmental Impact,Environmental Science,17,3,Physical Sciences,2
11691,Forest Insect Ecology and Management,Environmental Science,17,3,Physical Sciences,2
11791,Microbial Community Ecology and Physiology,Environmental Science,17,3,Physical Sciences,2
11913,Animal Ecology and Behavior Studies,Environmental Science,17,3,Physical Sciences,2
12073,Isotope Analysis in Ecology,Environmental Science,17,3,Physical Sciences,2
12091,Peatlands and Wetlands Ecology,Environmental Science,17,3,Physical Sciences,2
12097,Aquatic Invertebrate Ecology and Behavior,Environmental Science,17,3,Physical Sciences,2
12180,Polar Research and Ecology,Environmental Science,17,3,Physical Sciences,2
12640,Environmental DNA in Biodiversity Studies,Environmental Science,17,3,Physical Sciences,2
12644,Wildlife-Road Interactions and Conservation,Environmental Science,17,3,Physical Sciences,2
12703,Oil Palm Production and Sustainability,Environmental Science,17,3,Physical Sciences,2
13388,Rangeland and Wildlife Management,Environmental Science,17,3,Physical Sciences,2
13485,Marine and Coastal Ecosystems,Environmental Science,17,3,Physical Sciences,2
13490,Aquatic Ecosystems and Biodiversity,Environmental Science,17,3,Physical Sciences,2
13548,Environmental and biological studies,Environmental Science,17,3,Physical Sciences,2
13882,Research studies in Vietnam,Environmental Science,17,3,Physical Sciences,2
13909,Environmental Quality and Pollution,Environmental Science,17,3,Physical Sciences,2
14039,Ecology and biodiversity studies,Environmental Science,17,3,Physical Sciences,2
14177,Water Resources and Management,Environmental Science,17,3,Physical Sciences,2
14468,Plant Ecology and Soil Science,Environmental Science,17,3,Physical Sciences,2
14472,Environmental and Cultural Studies in Latin America and Beyond,Environmental Science,17,3,Physical Sciences,2
10236,Aquatic Ecosystems and Phytoplankton Dynamics,Environmental Science,17,3,Physical Sciences,2
10710,Arsenic contamination and mitigation,Environmental Science,17,3,Physical Sciences,2
10995,Methane Hydrates and Related Phenomena,Environmental Science,17,3,Physical Sciences,2
11311,Soil and Water Nutrient Dynamics,Environmental Science,17,3,Physical Sciences,2
11869,Per- and polyfluoroalkyl substances research,Environmental Science,17,3,Physical Sciences,2
11923,Mine drainage and remediation techniques,Environmental Science,17,3,Physical Sciences,2
11985,Marine Toxins and Detection Methods,Environmental Science,17,3,Physical Sciences,2
12822,Turfgrass Adaptation and Management,Environmental Science,17,3,Physical Sciences,2
12896,Sustainable Agricultural Systems Analysis,Environmental Science,17,3,Physical Sciences,2
13092,Environmental Chemistry and Analysis,Environmental Science,17,3,Physical Sciences,2
13180,Chemistry and Chemical Engineering,Environmental Science,17,3,Physical Sciences,2
10435,Environmental Impact and Sustainability,Environmental Science,17,3,Physical Sciences,2
10766,Urban Heat Island Mitigation,Environmental Science,17,3,Physical Sciences,2
10770,Soil Geostatistics and Mapping,Environmental Science,17,3,Physical Sciences,2
10894,Groundwater flow and contamination studies,Environmental Science,17,3,Physical Sciences,2
11119,Urban Stormwater Management Solutions,Environmental Science,17,3,Physical Sciences,2
11164,Remote Sensing and LiDAR Applications,Environmental Science,17,3,Physical Sciences,2
11231,Microbial Fuel Cells and Bioremediation,Environmental Science,17,3,Physical Sciences,2
11302,CO2 Sequestration and Geologic Interactions,Environmental Science,17,3,Physical Sciences,2
11312,Soil Moisture and Remote Sensing,Environmental Science,17,3,Physical Sciences,2
11371,Wind and Air Flow Studies,Environmental Science,17,3,Physical Sciences,2
11490,Hydrological Forecasting Using AI,Environmental Science,17,3,Physical Sciences,2
12120,Air Quality Monitoring and Forecasting,Environmental Science,17,3,Physical Sciences,2
12126,Maritime Transport Emissions and Efficiency,Environmental Science,17,3,Physical Sciences,2
12247,Microbial Applications in Construction Materials,Environmental Science,17,3,Physical Sciences,2
12543,Groundwater and Watershed Analysis,Environmental Science,17,3,Physical Sciences,2
12643,Sustainability and Ecological Systems Analysis,Environmental Science,17,3,Physical Sciences,2
12838,Photovoltaic Systems and Sustainability,Environmental Science,17,3,Physical Sciences,2
13148,Environmental and Air Quality Management,Environmental Science,17,3,Physical Sciences,2
13517,Environmental and Industrial Safety,Environmental Science,17,3,Physical Sciences,2
10029,Climate variability and models,Environmental Science,17,3,Physical Sciences,2
10119,Sustainability and Climate Change Governance,Environmental Science,17,3,Physical Sciences,2
10226,Land Use and Ecosystem Services,Environmental Science,17,3,Physical Sciences,2
10230,Marine and fisheries research,Environmental Science,17,3,Physical Sciences,2
10266,Plant Water Relations and Carbon Dynamics,Environmental Science,17,3,Physical Sciences,2
10319,"Conservation, Biodiversity, and Resource Management",Environmental Science,17,3,Physical Sciences,2
10332,Amphibian and Reptile Biology,Environmental Science,17,3,Physical Sciences,2
10347,Atmospheric aerosols and clouds,Environmental Science,17,3,Physical Sciences,2
10555,Fire effects on ecosystems,Environmental Science,17,3,Physical Sciences,2
10930,Flood Risk Assessment and Management,Environmental Science,17,3,Physical Sciences,2
11088,Marine Bivalve and Aquaculture Studies,Environmental Science,17,3,Physical Sciences,2
11089,Radioactive contamination and transfer,Environmental Science,17,3,Physical Sciences,2
11186,Hydrology and Drought Analysis,Environmental Science,17,3,Physical Sciences,2
11524,Advanced Aircraft Design and Technologies,Environmental Science,17,3,Physical Sciences,2
11588,Atmospheric and Environmental Gas Dynamics,Environmental Science,17,3,Physical Sciences,2
11753,Forest Management and Policy,Environmental Science,17,3,Physical Sciences,2
11963,Impact of Light on Environment and Health,Environmental Science,17,3,Physical Sciences,2
12213,Marine Ecology and Invasive Species,Environmental Science,17,3,Physical Sciences,2
12615,Climate Change and Geoengineering,Environmental Science,17,3,Physical Sciences,2
12916,COVID-19 impact on air quality,Environmental Science,17,3,Physical Sciences,2
